{
  "schema_version": "q-demo.q2-response.v1",
  "status": "COMPLETE",
  "reason": null,
  "resolved_scope": {
    "scene_id": "SCENE_SYN",
    "scene_revision": "rSYN",
    "run_ids": [
      "RUN_X"
    ],
    "clock_ids": [
      "CLOCK_X"
    ],
    "clock_mapping_sha256": "c079d1675d83a33a73319e4c869b29619526ca3f824f47bfec9825b8d2ac9d82",
    "requested_time": {
      "kind": "WALL",
      "wall_range": [
        "2026-11-01T13:00:00+08:00",
        "2026-11-01T13:00:21+08:00"
      ]
    },
    "resolved_source_ranges_us": [
      {
        "run_id": "RUN_X",
        "range_us": [
          0,
          21000000
        ]
      }
    ],
    "time_coverage": {
      "coverage_complete": true,
      "uncovered_wall_ranges": []
    },
    "camera_ids": [
      "CAM_A",
      "CAM_B",
      "CAM_D",
      "CAM_E"
    ],
    "detection_index_id": "detidx:rSYN:RUN_X:f96c0d0ec4417b67",
    "detection_index_sha256": "9dc66e460146b335b8d3693ad3ce998f195769762e540b9c7617ed06abffc7ab",
    "region_graph_sha256": "76742ecb3a533ca4c674d7522df2bb3d390fd33b5c8afe94073b17a04b0a3170",
    "camera_graph_sha256": "c761480ce38d266597002c5ce54b9812fb1b94b270f1ee59db4f3c1ea3043e90",
    "class_map_sha256": "63443db18b306baa5eb5c7480c97c3ad866d38d01a58082cc9a6f05e747a986f",
    "color_method_version": "synthetic-hsv-v0",
    "parameter_set_id": "pset:q-demo:e08a0778ee3a08a5",
    "parameter_set_sha256": "e08a0778ee3a08a5e7bb6ce7f265881449f4a9a381a1ddd042e0cb14d57501df"
  },
  "identity_verdict": "UNCONFIRMED",
  "llm_parse_used": false,
  "agent_attempted": false,
  "agent_used": false,
  "decision_source": "RULE_ONLY",
  "fallback_used": false,
  "fallback_reason": null,
  "provenance": {
    "producer": "SYNTHETIC-producer",
    "producer_version": "0",
    "gt_read": false,
    "input_refs": [
      "index:SYNTHETIC"
    ]
  },
  "stats": {
    "latency_ms": {
      "total": 12
    }
  },
  "session_id": "sess_rule",
  "timeline": [
    {
      "segment_id": "seg-0",
      "kind": "ON_CAMERA",
      "camera_id": "CAM_A",
      "range_us": [
        0,
        8400000
      ],
      "entered_by": "SEED",
      "decided_by": "USER",
      "observation_ids": [
        "obs:f96c0d0ec4417b67:CAM_A:0:0",
        "obs:f96c0d0ec4417b67:CAM_A:40:0"
      ],
      "presence_at_entry": "MATCH_STRONG"
    },
    {
      "segment_id": "seg-1",
      "kind": "GAP",
      "range_us": [
        8400000,
        13600000
      ],
      "gap_states": [
        "TEMP_LOST",
        "SEARCHING"
      ],
      "camera_shown": "CAM_A",
      "position": null
    },
    {
      "segment_id": "seg-2",
      "kind": "ON_CAMERA",
      "camera_id": "CAM_B",
      "range_us": [
        13600000,
        21000000
      ],
      "entered_by": "SWITCH",
      "decided_by": "RULE_ONLY",
      "decision_id": "sess_rule-dec-4",
      "observation_ids": [
        "obs:f96c0d0ec4417b67:CAM_B:68:0"
      ],
      "presence_at_entry": "MATCH_STRONG"
    }
  ],
  "decisions_ref": "sess_rule.decisions.jsonl",
  "decisions_sha256": "95b25d197699a08d2d3ee7f1bd40fbf22997d08fde7eb84a923d3ec31f4462a0",
  "links_ref": "sess_rule.links.jsonl",
  "links_sha256": "5c0423490e4c322ccb831c0f4151ec4e3e4792fa84a7a0db45a414b9d3511f8a",
  "output_sha256": "99425667c43e187bdda4fd0e0215b558ed47cf39381a71798ac347175aa2a493"
}
